{
  "schemaVersion": 1,
  "source": {
    "kind": "chatgpt-web",
    "url": "https://chatgpt.com/c/codexbridge-fixture",
    "conversationId": "codexbridge-fixture",
    "title": "Codex Bridge 捕获协议示例"
  },
  "capture": {
    "capturedAt": "2026-09-11T08:00:00Z",
    "scope": "rendered-current-page",
    "attachmentCount": 0,
    "complete": true
  },
  "selection": {
    "selectedTurnIds": ["turn-0"]
  },
  "turns": [
    {
      "id": "turn-0",
      "index": 0,
      "user": { "id": "message-user-0", "idSource": "dom", "text": "请梳理 Codex Bridge 的关键流程。" },
      "assistant": { "id": "message-assistant-0", "idSource": "dom", "text": "先捕获，再整理，最后由用户确认 Handoff。" },
      "complete": true
    }
  ],
  "warnings": []
}
